{
  "$schema": "https://json-schema.org/draft/2020-12/schema",
  "$id": "urn:magic-glass-box:schema:workflow-configuration:v1",
  "title": "Magic Glass Box Implementation Workflow Configuration v1",
  "type": "object",
  "additionalProperties": false,
  "required": [
    "landing_mode",
    "maintainer_approval",
    "max_correction_rounds",
    "review_separation",
    "schema_version",
    "validations"
  ],
  "properties": {
    "landing_mode": { "enum": ["manual", "provider"] },
    "maintainer_approval": { "type": "boolean" },
    "max_correction_rounds": {
      "type": "integer",
      "minimum": 1,
      "maximum": 8
    },
    "review_separation": {
      "enum": [
        "different_profile",
        "different_identity",
        "different_profile_and_identity"
      ]
    },
    "schema_version": { "const": 1 },
    "validations": {
      "type": "array",
      "maxItems": 32,
      "items": { "$ref": "#/$defs/validation" }
    }
  },
  "$defs": {
    "validation": {
      "type": "object",
      "additionalProperties": false,
      "required": ["command", "image_id", "name"],
      "properties": {
        "command": {
          "type": "array",
          "minItems": 1,
          "maxItems": 64,
          "items": {
            "type": "string",
            "minLength": 1,
            "maxLength": 1024,
            "pattern": "^[^\\u0000]+$"
          }
        },
        "image_id": {
          "type": "string",
          "pattern": "^sha256:[0-9a-f]{64}$"
        },
        "name": {
          "type": "string",
          "pattern": "^[a-z][a-z0-9_-]{0,63}$"
        }
      }
    }
  }
}
